{
  "expected": {
    "admission": {
      "diagnostic": null,
      "status": "not_evaluated"
    },
    "capability": {
      "effect_class": null,
      "status": "not_evaluated"
    },
    "extensions": {},
    "final_authority": null,
    "graph_id": "g-recommend-1",
    "invalidation": "not_evaluated",
    "model_authorized": true,
    "model_level": "Recommend",
    "normalized_graph": {
      "sha256": "sha256:3337df3702a67458de9e95c232e09a927ca90214586bee05b6f800f6e9ab030e",
      "status": "asserted",
      "value": {
        "edges": [
          "m-Recommend-d"
        ],
        "nodes": [
          "m:ModelInvocation",
          "d:Decision"
        ]
      }
    },
    "provenance": true,
    "review": {
      "detail": null,
      "status": "not_required"
    }
  },
  "fixture_id": "EQ1A",
  "input": {
    "bundle": {
      "hash": "symbolic:bundle-rfc0029-fixtures-v1",
      "id": "bundle:rfc0029-fixtures",
      "version": 1
    },
    "catalog_entries": [],
    "edges": [
      {
        "kind": "Recommend",
        "source": "node:EQ1A:m",
        "target": "node:EQ1A:d"
      }
    ],
    "nodes": [
      {
        "attributes": {
          "decision_class": "decision:EQ1A:d"
        },
        "id": "node:EQ1A:d",
        "kind": "Decision"
      },
      {
        "attributes": {
          "deployment_id": "model:EQ1A:v1",
          "receipt_id": "receipt:EQ1A:m:v1"
        },
        "id": "node:EQ1A:m",
        "kind": "ModelInvocation"
      }
    ],
    "parameters": {}
  },
  "profile_id": "profile:rfc0029:manufacturing:candidate-v1",
  "schema_version": "rfc0029.influence-review.fixture.v1"
}
