{"expected":{"admission":{"diagnostic":"MandatoryDeny","status":"rejected"},"capability":{"effect_class":null,"status":"not_evaluated"},"extensions":{},"final_authority":"customs-officer","graph_id":"logistics-seizure-deny","invalidation":"not_evaluated","model_authorized":false,"model_level":"None","normalized_graph":{"status":"not_asserted"},"provenance":false,"review":{"detail":null,"status":"pass"}},"fixture_id":"L5","input":{"bundle":{"hash":"symbolic:bundle-rfc0029-fixtures-v1","id":"bundle:rfc0029-fixtures","version":1},"catalog_entries":[{"catalog":"authority","name":"customs-officer","value":{"id":"authority:customs-officer","version":1}}],"edges":[{"kind":"AssertDecision","source":"node:L5:a","target":"node:L5:d"},{"kind":"DataFlow","source":"node:L5:f","target":"node:L5:d"},{"kind":"HumanInput","source":"node:L5:v","target":"node:L5:a"}],"nodes":[{"attributes":{"id":"a"},"id":"node:L5:a","kind":"AuthorityAssertion"},{"attributes":{"decision_class":"decision:L5:d"},"id":"node:L5:d","kind":"Decision"},{"attributes":{"authority_class":"profile_authority","type_id":"fact:L5:f","version":1},"id":"node:L5:f","kind":"Fact"},{"attributes":{"review_contract":null},"id":"node:L5:v","kind":"Review"}],"parameters":{"mandatory_fact":{"id":"active-seizure-order","rule":"deny-release","value":true}}},"profile_id":"profile:rfc0029:logistics:candidate-v1","schema_version":"rfc0029.influence-review.fixture.v1"}