{"expected":{"admission":{"diagnostic":null,"status":"not_evaluated"},"capability":{"effect_class":null,"status":"not_evaluated"},"extensions":{},"final_authority":null,"graph_id":null,"invalidation":"not_evaluated","model_authorized":"unknown","model_level":"not_evaluated","normalized_graph":{"status":"not_asserted"},"provenance":"unknown","review":{"detail":"ReviewModeInsufficient","status":"fail"}},"fixture_id":"R2_ACK_FOR_APPROVAL","input":{"bundle":{"hash":"symbolic:bundle-rfc0029-fixtures-v1","id":"bundle:rfc0029-fixtures","version":1},"catalog_entries":[{"catalog":"predicate_definition","name":"acknowledged","value":{"authority":"authority:fixture-review-policy","expression":"review.acknowledged == true","id":"predicate:acknowledged","input_schema":["review.acknowledged:bool"],"kind":"ExplicitAction","result_type":"Bool","version":1}},{"catalog":"predicate_definition","name":"authenticated","value":{"authority":"authority:fixture-review-policy","expression":"subject.authenticated == true","id":"predicate:authenticated","input_schema":["subject.authenticated:bool"],"kind":"Qualification","result_type":"Bool","version":1}},{"catalog":"predicate_definition","name":"authority","value":{"authority":"authority:fixture-review-policy","expression":"reviewer.authorized == true","id":"predicate:authority","input_schema":["reviewer.authorized:bool"],"kind":"Authority","result_type":"Bool","version":1}},{"catalog":"predicate_definition","name":"capacity","value":{"authority":"authority:fixture-review-policy","expression":"review.capacity_healthy == true","id":"predicate:capacity","input_schema":["review.capacity_healthy:bool"],"kind":"CapacityHealthy","result_type":"Bool","version":1}},{"catalog":"predicate_definition","name":"escalation","value":{"authority":"authority:fixture-review-policy","expression":"review.escalation_available == true","id":"predicate:escalation","input_schema":["review.escalation_available:bool"],"kind":"EscalationAvailable","result_type":"Bool","version":1}},{"catalog":"predicate_definition","name":"evidence_available","value":{"authority":"authority:fixture-review-policy","expression":"evidence.available == true","id":"predicate:evidence-available","input_schema":["evidence.available:bool"],"kind":"EvidenceAvailable","result_type":"Bool","version":1}},{"catalog":"predicate_definition","name":"explicit_action","value":{"authority":"authority:fixture-review-policy","expression":"review.explicit_action == true","id":"predicate:explicit-action","input_schema":["review.explicit_action:bool"],"kind":"ExplicitAction","result_type":"Bool","version":1}},{"catalog":"predicate_definition","name":"override","value":{"authority":"authority:fixture-review-policy","expression":"review.override_available == true","id":"predicate:override","input_schema":["review.override_available:bool"],"kind":"OverrideAvailable","result_type":"Bool","version":1}},{"catalog":"predicate_definition","name":"reason_bound","value":{"authority":"authority:fixture-review-policy","expression":"review.reason_bound == true","id":"predicate:reason-bound","input_schema":["review.reason_bound:bool"],"kind":"ReasonBound","result_type":"Bool","version":1}},{"catalog":"predicate_definition","name":"sampling","value":{"authority":"authority:fixture-review-policy","expression":"review.sampling_assigned == true","id":"predicate:sampling","input_schema":["review.sampling_assigned:bool"],"kind":"SamplingAssigned","result_type":"Bool","version":1}},{"catalog":"review_contract","name":"rc-ack","value":{"authority":"authority:fixture-review-policy","id":"review-contract:ack","mode":"Acknowledgement","predicates":["authenticated","acknowledged"],"version":1}},{"catalog":"review_contract","name":"rc-bounded","value":{"authority":"authority:fixture-review-policy","id":"review-contract:bounded","mode":"BoundedApproval","predicates":["authenticated","authority","evidence_available","explicit_action","reason_bound","override","escalation","capacity","sampling"],"version":1}}],"edges":[],"nodes":[],"parameters":{"evaluations":[{"definition_id":"predicate:authenticated","definition_version":1,"evaluated_at":"2026-09-27T00:00:00Z","evaluator_authority":"authority:fixture-review-evaluator:v1","evidence_commitment":"symbolic:R2_ACK_FOR_APPROVAL:authenticated:evidence","failure_behavior":"Deny","input_commitment":"symbolic:R2_ACK_FOR_APPROVAL:authenticated:inputs","predicate":"authenticated","result":"True","revoked":false,"valid_until":"2026-09-28T00:00:00Z"},{"definition_id":"predicate:acknowledged","definition_version":1,"evaluated_at":"2026-09-27T00:00:00Z","evaluator_authority":"authority:fixture-review-evaluator:v1","evidence_commitment":"symbolic:R2_ACK_FOR_APPROVAL:acknowledged:evidence","failure_behavior":"Deny","input_commitment":"symbolic:R2_ACK_FOR_APPROVAL:acknowledged:inputs","predicate":"acknowledged","result":"True","revoked":false,"valid_until":"2026-09-28T00:00:00Z"}],"required_review_contract":"rc-bounded","supplied_review_contract":"rc-ack"}},"profile_id":"profile:rfc0029:cross-domain:candidate-v1","schema_version":"rfc0029.influence-review.fixture.v1"}