{"expected":{"admission":{"diagnostic":"ReviewSelfCertification","status":"rejected"},"capability":{"effect_class":null,"status":"not_evaluated"},"extensions":{},"final_authority":null,"graph_id":"banking-self-close","invalidation":"not_evaluated","model_authorized":true,"model_level":"Approve","normalized_graph":{"status":"not_asserted"},"provenance":true,"review":{"detail":"SelfCertification","status":"fail"}},"fixture_id":"B7","input":{"bundle":{"hash":"symbolic:bundle-rfc0029-fixtures-v1","id":"bundle:rfc0029-fixtures","version":1},"catalog_entries":[{"catalog":"predicate_definition","name":"acknowledged","value":{"authority":"authority:fixture-review-policy","expression":"review.acknowledged == true","id":"predicate:acknowledged","input_schema":["review.acknowledged:bool"],"kind":"ExplicitAction","result_type":"Bool","version":1}},{"catalog":"predicate_definition","name":"authenticated","value":{"authority":"authority:fixture-review-policy","expression":"subject.authenticated == true","id":"predicate:authenticated","input_schema":["subject.authenticated:bool"],"kind":"Qualification","result_type":"Bool","version":1}},{"catalog":"predicate_definition","name":"authority","value":{"authority":"authority:fixture-review-policy","expression":"reviewer.authorized == true","id":"predicate:authority","input_schema":["reviewer.authorized:bool"],"kind":"Authority","result_type":"Bool","version":1}},{"catalog":"predicate_definition","name":"capacity","value":{"authority":"authority:fixture-review-policy","expression":"review.capacity_healthy == true","id":"predicate:capacity","input_schema":["review.capacity_healthy:bool"],"kind":"CapacityHealthy","result_type":"Bool","version":1}},{"catalog":"predicate_definition","name":"escalation","value":{"authority":"authority:fixture-review-policy","expression":"review.escalation_available == true","id":"predicate:escalation","input_schema":["review.escalation_available:bool"],"kind":"EscalationAvailable","result_type":"Bool","version":1}},{"catalog":"predicate_definition","name":"evidence_accessed","value":{"authority":"authority:fixture-review-policy","expression":"evidence.accessed == true","id":"predicate:evidence-accessed","input_schema":["evidence.accessed:bool"],"kind":"EvidenceAccessed","result_type":"Bool","version":1}},{"catalog":"predicate_definition","name":"evidence_available","value":{"authority":"authority:fixture-review-policy","expression":"evidence.available == true","id":"predicate:evidence-available","input_schema":["evidence.available:bool"],"kind":"EvidenceAvailable","result_type":"Bool","version":1}},{"catalog":"predicate_definition","name":"explicit_action","value":{"authority":"authority:fixture-review-policy","expression":"review.explicit_action == true","id":"predicate:explicit-action","input_schema":["review.explicit_action:bool"],"kind":"ExplicitAction","result_type":"Bool","version":1}},{"catalog":"predicate_definition","name":"independence","value":{"authority":"authority:fixture-review-policy","expression":"reviewer.independent == true","id":"predicate:independence","input_schema":["reviewer.independent:bool"],"kind":"Independence","result_type":"Bool","version":1}},{"catalog":"predicate_definition","name":"independent_choice","value":{"authority":"authority:fixture-review-policy","expression":"review.independent_choice == true","id":"predicate:independent-choice","input_schema":["review.independent_choice:bool"],"kind":"IndependentOutcomeChoice","result_type":"Bool","version":1}},{"catalog":"predicate_definition","name":"limitations_visible","value":{"authority":"authority:fixture-review-policy","expression":"model.limitations_visible == true","id":"predicate:limitations-visible","input_schema":["model.limitations_visible:bool"],"kind":"LimitationVisible","result_type":"Bool","version":1}},{"catalog":"predicate_definition","name":"override","value":{"authority":"authority:fixture-review-policy","expression":"review.override_available == true","id":"predicate:override","input_schema":["review.override_available:bool"],"kind":"OverrideAvailable","result_type":"Bool","version":1}},{"catalog":"predicate_definition","name":"qualification","value":{"authority":"authority:fixture-review-policy","expression":"reviewer.qualified == true","id":"predicate:qualification","input_schema":["reviewer.qualified:bool"],"kind":"Qualification","result_type":"Bool","version":1}},{"catalog":"predicate_definition","name":"reason_bound","value":{"authority":"authority:fixture-review-policy","expression":"review.reason_bound == true","id":"predicate:reason-bound","input_schema":["review.reason_bound:bool"],"kind":"ReasonBound","result_type":"Bool","version":1}},{"catalog":"predicate_definition","name":"sampling","value":{"authority":"authority:fixture-review-policy","expression":"review.sampling_assigned == true","id":"predicate:sampling","input_schema":["review.sampling_assigned:bool"],"kind":"SamplingAssigned","result_type":"Bool","version":1}},{"catalog":"review_contract","name":"self-review","value":{"authority":"authority:fixture-review-policy","evaluation_fixture":"R4_CONFLICT","id":"review-contract:self-review","mode":"IndependentDecision","predicates":["authenticated","acknowledged","qualification","authority","independence","evidence_available","evidence_accessed","limitations_visible","explicit_action","reason_bound","override","escalation","capacity","independent_choice","sampling"],"version":1}}],"edges":[{"kind":"ModelApproval","source":"node:B7:m","target":"node:B7:d"}],"nodes":[{"attributes":{"decision_class":"decision:B7:d"},"id":"node:B7:d","kind":"Decision"},{"attributes":{"deployment_id":"model:B7:v1","receipt_id":"receipt:B7:m:v1"},"id":"node:B7:m","kind":"ModelInvocation"}],"parameters":{"declared_binding":"Approve","review_contract":"self-review"}},"profile_id":"profile:rfc0029:banking:candidate-v1","schema_version":"rfc0029.influence-review.fixture.v1"}