{"expected":{"admission":{"diagnostic":null,"status":"accepted"},"capability":{"effect_class":"funds.reserve","status":"issued"},"extensions":{},"final_authority":"bank","graph_id":"banking-no-model","invalidation":"not_evaluated","model_authorized":false,"model_level":"None","normalized_graph":{"status":"not_asserted"},"provenance":false,"review":{"detail":null,"status":"not_required"}},"fixture_id":"B1","input":{"bundle":{"hash":"symbolic:bundle-rfc0029-fixtures-v1","id":"bundle:rfc0029-fixtures","version":1},"catalog_entries":[{"catalog":"authority","name":"bank","value":{"id":"authority:bank","version":1}}],"edges":[{"kind":"Authorize","source":"node:B1:d","target":"node:B1:c"},{"kind":"DataFlow","source":"node:B1:f","target":"node:B1:r"},{"kind":"Issue","source":"node:B1:c","target":"node:B1:x"},{"kind":"RuleFlow","source":"node:B1:r","target":"node:B1:d"}],"nodes":[{"attributes":{"effect_class":"funds.reserve"},"id":"node:B1:c","kind":"Capability"},{"attributes":{"decision_class":"decision:B1:d"},"id":"node:B1:d","kind":"Decision"},{"attributes":{"effect_id":"funds.reserve","reversibility_class":"Reversible"},"id":"node:B1:x","kind":"Effect"},{"attributes":{"authority_class":"profile_authority","type_id":"fact:B1:f","version":1},"id":"node:B1:f","kind":"Fact"},{"attributes":{"bundle_hash":"symbolic:bundle-rfc0029-fixtures-v1","rule_id":"rule:B1:r"},"id":"node:B1:r","kind":"Rule"}],"parameters":{"admission_policy":{"effect_class":"funds.reserve","maximum_model_level":"None"}}},"profile_id":"profile:rfc0029:banking:candidate-v1","schema_version":"rfc0029.influence-review.fixture.v1"}