{"expected":{"admission":{"diagnostic":null,"status":"not_evaluated"},"capability":{"effect_class":null,"status":"not_evaluated"},"extensions":{"duplicate_effect":"forbidden","workflow_state":"UnknownOutcome"},"final_authority":null,"graph_id":null,"invalidation":"Reconcile","model_authorized":"unknown","model_level":"not_evaluated","normalized_graph":{"status":"not_asserted"},"provenance":"unknown","review":{"detail":null,"status":"not_evaluated"}},"fixture_id":"M8","input":{"bundle":{"hash":"symbolic:bundle-rfc0029-fixtures-v1","id":"bundle:rfc0029-fixtures","version":1},"catalog_entries":[],"edges":[],"nodes":[],"parameters":{"dependency":{"action":"Reconcile","id":"firmware-attestation-version","phase":"after_external_unknown"}}},"profile_id":"profile:rfc0029:manufacturing:candidate-v1","schema_version":"rfc0029.influence-review.fixture.v1"}