{"expected":{"admission":{"diagnostic":"MandatoryDeny","status":"rejected"},"capability":{"effect_class":null,"status":"not_evaluated"},"extensions":{},"final_authority":"compliance-reviewer","graph_id":"kyc-adverse-media-deny","invalidation":"not_evaluated","model_authorized":false,"model_level":"None","normalized_graph":{"status":"not_asserted"},"provenance":false,"review":{"detail":null,"status":"pass"}},"fixture_id":"K9","input":{"bundle":{"hash":"symbolic:bundle-rfc0029-fixtures-v1","id":"bundle:rfc0029-fixtures","version":1},"catalog_entries":[{"catalog":"authority","name":"compliance-reviewer","value":{"id":"authority:compliance-reviewer","version":1}}],"edges":[{"kind":"AssertDecision","source":"node:K9:a","target":"node:K9:d"},{"kind":"DataFlow","source":"node:K9:f","target":"node:K9:d"},{"kind":"HumanInput","source":"node:K9:v","target":"node:K9:a"}],"nodes":[{"attributes":{"id":"a"},"id":"node:K9:a","kind":"AuthorityAssertion"},{"attributes":{"decision_class":"decision:K9:d"},"id":"node:K9:d","kind":"Decision"},{"attributes":{"authority_class":"profile_authority","type_id":"fact:K9:f","version":1},"id":"node:K9:f","kind":"Fact"},{"attributes":{"review_contract":null},"id":"node:K9:v","kind":"Review"}],"parameters":{"mandatory_fact":{"id":"adverse-media-confirmed","rule":"deny-onboarding","value":true}}},"profile_id":"profile:rfc0029:kyc:candidate-v1","schema_version":"rfc0029.influence-review.fixture.v1"}