{
  "expected": {
    "admission": {
      "diagnostic": "ObserveOnlyAttestationStale",
      "status": "indeterminate"
    },
    "capability": {
      "effect_class": null,
      "status": "not_evaluated"
    },
    "extensions": {},
    "final_authority": null,
    "graph_id": "banking-shadow-stale",
    "invalidation": "not_evaluated",
    "model_authorized": "unknown",
    "model_level": "Unknown",
    "normalized_graph": {
      "status": "not_asserted"
    },
    "provenance": "unknown",
    "review": {
      "detail": null,
      "status": "not_required"
    }
  },
  "fixture_id": "B2_STALE",
  "input": {
    "bundle": {
      "hash": "symbolic:bundle-rfc0029-fixtures-v1",
      "id": "bundle:rfc0029-fixtures",
      "version": 1
    },
    "catalog_entries": [
      {
        "catalog": "observe_certificate",
        "name": "cert-shadow-stale",
        "value": {
          "allowed_channels": [
            {
              "direction": "one-way",
              "source": "decision-copy-tap",
              "target": "isolated-shadow-sink"
            }
          ],
          "boundary": {
            "components": [
              "decision-copy-tap",
              "isolated-shadow-sink"
            ],
            "protected_targets": [
              "all-fixture-protected-targets"
            ]
          },
          "dependency_graph_hash": "symbolic:shadow-dependency-graph-v1",
          "enforcement": {
            "attestation": "symbolic:fixture-sandbox-attestation-v1",
            "mechanism_id": "fixture-one-way-sandbox",
            "version": 1
          },
          "forbidden_return_classes": [
            "data",
            "control",
            "configuration",
            "scheduling_priority",
            "shared_mutable_state",
            "credential_or_capability"
          ],
          "invalidation": [
            "topology-change",
            "policy-change",
            "credential-change",
            "shared-resource-change"
          ],
          "model_sink": "isolated-shadow-sink",
          "shared_resources": [],
          "unmodeled_channel_behavior": "Indeterminate",
          "valid_from": "2026-09-25T00:00:00Z",
          "valid_until": "2026-09-26T00:00:00Z"
        }
      }
    ],
    "edges": [
      {
        "kind": "ObserveOnly",
        "source": "node:B2_STALE:m",
        "target": "node:B2_STALE:e"
      }
    ],
    "nodes": [
      {
        "attributes": {
          "evidence_type": "evidence:B2_STALE:e"
        },
        "id": "node:B2_STALE:e",
        "kind": "Evidence"
      },
      {
        "attributes": {
          "deployment_id": "model:B2_STALE:v1",
          "receipt_id": "receipt:B2_STALE:m:v1"
        },
        "id": "node:B2_STALE:m",
        "kind": "ModelInvocation"
      }
    ],
    "parameters": {}
  },
  "profile_id": "profile:rfc0029:banking:candidate-v1",
  "schema_version": "rfc0029.influence-review.fixture.v1"
}
