{"expected":{"admission":{"diagnostic":null,"status":"accepted"},"capability":{"effect_class":"work_order.approve","status":"issued"},"extensions":{},"final_authority":"maintenance-supervisor","graph_id":"mfg-no-model","invalidation":"not_evaluated","model_authorized":false,"model_level":"None","normalized_graph":{"status":"not_asserted"},"provenance":false,"review":{"detail":null,"status":"not_required"}},"fixture_id":"M6","input":{"bundle":{"hash":"symbolic:bundle-rfc0029-fixtures-v1","id":"bundle:rfc0029-fixtures","version":1},"catalog_entries":[{"catalog":"authority","name":"maintenance-supervisor","value":{"id":"authority:maintenance-supervisor","version":1}}],"edges":[{"kind":"Authorize","source":"node:M6:d","target":"node:M6:c"},{"kind":"DataFlow","source":"node:M6:f","target":"node:M6:r"},{"kind":"Issue","source":"node:M6:c","target":"node:M6:x"},{"kind":"RuleFlow","source":"node:M6:r","target":"node:M6:d"}],"nodes":[{"attributes":{"effect_class":"work_order.approve"},"id":"node:M6:c","kind":"Capability"},{"attributes":{"decision_class":"decision:M6:d"},"id":"node:M6:d","kind":"Decision"},{"attributes":{"effect_id":"work_order.approve","reversibility_class":"Reversible"},"id":"node:M6:x","kind":"Effect"},{"attributes":{"authority_class":"profile_authority","type_id":"fact:M6:f","version":1},"id":"node:M6:f","kind":"Fact"},{"attributes":{"bundle_hash":"symbolic:bundle-rfc0029-fixtures-v1","rule_id":"rule:M6:r"},"id":"node:M6:r","kind":"Rule"}],"parameters":{"admission_policy":{"effect_class":"work_order.approve","maximum_model_level":"Recommend"}}},"profile_id":"profile:rfc0029:manufacturing:candidate-v1","schema_version":"rfc0029.influence-review.fixture.v1"}