{
  "expected": {
    "admission": {
      "diagnostic": null,
      "status": "accepted"
    },
    "capability": {
      "effect_class": "order.sign",
      "status": "issued"
    },
    "extensions": {},
    "final_authority": "clinician",
    "graph_id": "health-no-model",
    "invalidation": "not_evaluated",
    "model_authorized": false,
    "model_level": "None",
    "normalized_graph": {
      "status": "not_asserted"
    },
    "provenance": false,
    "review": {
      "detail": null,
      "status": "not_required"
    }
  },
  "fixture_id": "H5",
  "input": {
    "bundle": {
      "hash": "symbolic:bundle-rfc0029-fixtures-v1",
      "id": "bundle:rfc0029-fixtures",
      "version": 1
    },
    "catalog_entries": [
      {
        "catalog": "authority",
        "name": "clinician",
        "value": {
          "id": "authority:clinician",
          "version": 1
        }
      }
    ],
    "edges": [
      {
        "kind": "Authorize",
        "source": "node:H5:d",
        "target": "node:H5:c"
      },
      {
        "kind": "DataFlow",
        "source": "node:H5:f",
        "target": "node:H5:r"
      },
      {
        "kind": "Issue",
        "source": "node:H5:c",
        "target": "node:H5:x"
      },
      {
        "kind": "RuleFlow",
        "source": "node:H5:r",
        "target": "node:H5:d"
      }
    ],
    "nodes": [
      {
        "attributes": {
          "effect_class": "order.sign"
        },
        "id": "node:H5:c",
        "kind": "Capability"
      },
      {
        "attributes": {
          "decision_class": "decision:H5:d"
        },
        "id": "node:H5:d",
        "kind": "Decision"
      },
      {
        "attributes": {
          "effect_id": "order.sign",
          "reversibility_class": "Reversible"
        },
        "id": "node:H5:x",
        "kind": "Effect"
      },
      {
        "attributes": {
          "authority_class": "profile_authority",
          "type_id": "fact:H5:f",
          "version": 1
        },
        "id": "node:H5:f",
        "kind": "Fact"
      },
      {
        "attributes": {
          "bundle_hash": "symbolic:bundle-rfc0029-fixtures-v1",
          "rule_id": "rule:H5:r"
        },
        "id": "node:H5:r",
        "kind": "Rule"
      }
    ],
    "parameters": {
      "admission_policy": {
        "effect_class": "order.sign",
        "maximum_model_level": "Draft"
      }
    }
  },
  "profile_id": "profile:rfc0029:healthcare:candidate-v1",
  "schema_version": "rfc0029.influence-review.fixture.v1"
}
