{"expected":{"admission":{"diagnostic":null,"status":"accepted"},"capability":{"effect_class":"application.reject","status":"issued"},"extensions":{},"final_authority":"compliance-reviewer","graph_id":"kyc-no-model","invalidation":"not_evaluated","model_authorized":false,"model_level":"None","normalized_graph":{"status":"not_asserted"},"provenance":false,"review":{"detail":null,"status":"not_required"}},"fixture_id":"K2","input":{"bundle":{"hash":"symbolic:bundle-rfc0029-fixtures-v1","id":"bundle:rfc0029-fixtures","version":1},"catalog_entries":[{"catalog":"authority","name":"compliance-reviewer","value":{"id":"authority:compliance-reviewer","version":1}}],"edges":[{"kind":"Authorize","source":"node:K2:d","target":"node:K2:c"},{"kind":"DataFlow","source":"node:K2:f","target":"node:K2:r"},{"kind":"Issue","source":"node:K2:c","target":"node:K2:x"},{"kind":"RuleFlow","source":"node:K2:r","target":"node:K2:d"}],"nodes":[{"attributes":{"effect_class":"application.reject"},"id":"node:K2:c","kind":"Capability"},{"attributes":{"decision_class":"decision:K2:d"},"id":"node:K2:d","kind":"Decision"},{"attributes":{"effect_id":"application.reject","reversibility_class":"Irreversible"},"id":"node:K2:x","kind":"Effect"},{"attributes":{"authority_class":"profile_authority","type_id":"fact:K2:f","version":1},"id":"node:K2:f","kind":"Fact"},{"attributes":{"bundle_hash":"symbolic:bundle-rfc0029-fixtures-v1","rule_id":"rule:K2:r"},"id":"node:K2:r","kind":"Rule"}],"parameters":{"admission_policy":{"effect_class":"application.reject","maximum_model_level":"Recommend"}}},"profile_id":"profile:rfc0029:kyc:candidate-v1","schema_version":"rfc0029.influence-review.fixture.v1"}