{"expected":{"admission":{"diagnostic":null,"status":"not_evaluated"},"capability":{"effect_class":null,"status":"not_evaluated"},"extensions":{},"final_authority":null,"graph_id":"g-prioritize-1","invalidation":"not_evaluated","model_authorized":true,"model_level":"Prioritize","normalized_graph":{"sha256":"sha256:4fcb2c3b4b695fc5489e787a5feccac3008d43729743b3b55c6bbe4399ba8542","status":"asserted","value":{"edges":["m-Rank-p","p-Attention-v"],"nodes":["m:ModelInvocation","p:Presentation","v:Review"]}},"provenance":true,"review":{"detail":null,"status":"not_required"}},"fixture_id":"EQ2B","input":{"bundle":{"hash":"symbolic:bundle-rfc0029-fixtures-v1","id":"bundle:rfc0029-fixtures","version":1},"catalog_entries":[],"edges":[{"kind":"Attention","source":"node:EQ2B:p","target":"node:EQ2B:v"},{"kind":"DataFlow","source":"node:EQ2B:m","target":"node:EQ2B:t"},{"kind":"DataFlow","source":"node:EQ2B:t","target":"node:EQ2B:r"},{"kind":"Rank","source":"node:EQ2B:r","target":"node:EQ2B:p"}],"nodes":[{"attributes":{"deployment_id":"model:EQ2B:v1","receipt_id":"receipt:EQ2B:m:v1"},"id":"node:EQ2B:m","kind":"ModelInvocation"},{"attributes":{"surface_id":"surface:EQ2B:p","version":1},"id":"node:EQ2B:p","kind":"Presentation"},{"attributes":{"review_contract":null},"id":"node:EQ2B:v","kind":"Review"},{"attributes":{"bundle_hash":"symbolic:bundle-rfc0029-fixtures-v1","rule_id":"rule:EQ2B:r"},"id":"node:EQ2B:r","kind":"Rule"},{"attributes":{"transform_id":"transform:EQ2B:t","version":1},"id":"node:EQ2B:t","kind":"Transform"}],"parameters":{}},"profile_id":"profile:rfc0029:kyc:candidate-v1","schema_version":"rfc0029.influence-review.fixture.v1"}