{"expected":{"admission":{"diagnostic":"InfluenceLevelExceedsProfile","status":"rejected"},"capability":{"effect_class":null,"status":"not_issued"},"extensions":{},"final_authority":null,"graph_id":"mfg-restart","invalidation":"not_evaluated","model_authorized":true,"model_level":"ExecuteIrreversible","normalized_graph":{"status":"not_asserted"},"provenance":true,"review":{"detail":null,"status":"not_required"}},"fixture_id":"M3","input":{"bundle":{"hash":"symbolic:bundle-rfc0029-fixtures-v1","id":"bundle:rfc0029-fixtures","version":1},"catalog_entries":[],"edges":[{"kind":"ModelTrigger","source":"node:M3:m","target":"node:M3:x"}],"nodes":[{"attributes":{"effect_id":"machine.restart","reversibility_class":"Irreversible"},"id":"node:M3:x","kind":"Effect"},{"attributes":{"deployment_id":"model:M3:v1","receipt_id":"receipt:M3:m:v1"},"id":"node:M3:m","kind":"ModelInvocation"}],"parameters":{"admission_policy":{"effect_class":"machine.restart","maximum_model_level":"Approve"}}},"profile_id":"profile:rfc0029:manufacturing:candidate-v1","schema_version":"rfc0029.influence-review.fixture.v1"}